{"contract":"ONSURE_INDEPENDENCE_PROFILE_V2_CANDIDATE","profile_id":"ind-1","subject_id":"run-1","producer_principal_id":"producer-1","verifier_principal_id":"verifier-1","producer_admin_owner_id":"admin-a","verifier_admin_owner_id":"admin-b","principal_independence":true,"credential_admin_independence":true,"implementation_independence":true,"oracle_independence":true,"discovery_independence":true,"knowledge_independence":true,"shared_inputs_digest":"aaaaaaaaaaaaaaaaaaaaaaaaaaaaaaaaaaaaaaaaaaaaaaaaaaaaaaaaaaaaaaaa","assessment_receipt_sha256":"bbbbbbbbbbbbbbbbbbbbbbbbbbbbbbbbbbbbbbbbbbbbbbbbbbbbbbbbbbbbbbbb","state":"INDEPENDENT","profile_sha256":"cccccccccccccccccccccccccccccccccccccccccccccccccccccccccccccccc"}